{
  "schema": "coding-agent.job.v1",
  "jobId": "job_implement",
  "idempotencyKey": "task_fixture:implement:1",
  "taskId": "task_fixture",
  "stage": "implement",
  "attempt": 1,
  "workspace": {
    "repoRoot": "__REPO_ROOT__",
    "branch": "main",
    "expectedHead": "__HEAD__",
    "requireCleanAtStart": true
  },
  "agent": {
    "adapter": "pi",
    "profile": "implementer",
    "model": "kimi-coding/k3",
    "thinking": "high",
    "sessionId": null
  },
  "permissions": { "mode": "write" },
  "inputs": [
    {
      "kind": "plan",
      "path": "__PLAN_PATH__",
      "sha256": "__PLAN_SHA256__"
    }
  ],
  "expectedOutput": { "kind": "implementation", "schema": "implementation.v1" },
  "verification": [
    {
      "id": "check-unit",
      "argv": ["node", "--test", "test/greet.test.mjs"],
      "cwd": "__REPO_ROOT__",
      "timeoutSeconds": 30,
      "expectedExitCode": 0
    }
  ],
  "limits": { "timeoutSeconds": null }
}
